{
  "schemaVersion": 1,
  "id": "roblox.mm2.coin-collector",
  "name": "MM2 Coin Collector",
  "game": "Roblox",
  "experience": "Murder Mystery 2",
  "provider": "andrewwongwong/RobloxBot",
  "version": "1.0.0",
  "description": "Detecta moedas visíveis na tela e movimenta o personagem em direção a elas com evasão inteligente de jogadores.",
  "runtime": "python",
  "entrypoint": "main.py",
  "capabilities": [
    "screen_capture",
    "object_detection",
    "keyboard",
    "movement",
    "gpu",
    "models"
  ],
  "vision": {
    "provider": "legacy-yolov5",
    "models": ["yolo_coin_m_v3.pt", "yolo_coin_person_m_v2.pt"],
    "defaultConfidence": 0.25
  },
  "requirements": {
    "python": ">= 3.8",
    "gpuRecommended": true
  }
}
