{
  "schemaVersion": 1,
  "id": "template.vision.bot",
  "name": "Template Vision Bot",
  "game": "Generic Game",
  "experience": "Generic Experience",
  "provider": "internal",
  "version": "1.0.0",
  "description": "Template canônico para criação de novos bots baseados em visão computacional.",
  "runtime": "python",
  "entrypoint": "main.py",
  "capabilities": [
    "screen_capture",
    "object_detection",
    "keyboard",
    "movement"
  ],
  "vision": {
    "provider": "legacy-yolov5",
    "models": [],
    "defaultConfidence": 0.25
  },
  "requirements": {
    "python": ">= 3.8",
    "gpuRecommended": true
  }
}
